{
  "testName": "Aggressive Merging Configuration",
  "thresholds": {
    "japaneseMergeThreshold": 5,
    "segmenterThreshold": 2
  },
  "testCases": [
    {
      "input": "私は学校に行きます",
      "expectedWords": ["私は", "学校に", "行きます"],
      "description": "Aggressive particle merging - particles always merge with preceding word"
    },
    {
      "input": "これはテストです",
      "expectedWords": ["これは", "テストです"],
      "description": "Short copula 'です' merges with preceding word"
    },
    {
      "input": "彼が来た時",
      "expectedWords": ["彼が", "来た", "時"],
      "description": "Particle 'が' merges, auxiliary 'た' merges, time word '時' separate"
    },
    {
      "input": "本を読む",
      "expectedWords": ["本を", "読む"],
      "description": "Object marker を merges with noun"
    },
    {
      "input": "早く走れ",
      "expectedWords": ["早く", "走れ"],
      "description": "Short adverbs treated as single words due to low segmenter threshold"
    }
  ],
  "expectedBehavior": {
    "particleMerging": "aggressive",
    "segmenterUsage": "always",
    "navigationSmoothness": 5,
    "accuracy": 3
  },
  "useCases": [
    "Long-form Japanese text navigation",
    "Natural reading flow",
    "Minimal word jumping in prose",
    "Newspaper articles",
    "Novel reading"
  ],
  "notes": "This configuration prioritizes navigation smoothness over precise word boundaries. Best for reading continuous text where you want fewer, larger jumps."
}
