{
  "testName": "Balanced Configuration (Default)",
  "thresholds": {
    "japaneseMergeThreshold": 2,
    "segmenterThreshold": 4
  },
  "testCases": [
    {
      "input": "私は学校に行きます",
      "expectedWords": ["私", "は", "学校", "に", "行きます"],
      "description": "Moderate particle merging - short particles separate, longer words merge"
    },
    {
      "input": "これはテストです",
      "expectedWords": ["これ", "は", "テスト", "です"],
      "description": "Single-character particles remain separate"
    },
    {
      "input": "彼が来た時",
      "expectedWords": ["彼", "が", "来た", "時"],
      "description": "All particles separate for precise navigation"
    },
    {
      "input": "本を読む",
      "expectedWords": ["本", "を", "読む"],
      "description": "Object marker を remains separate"
    },
    {
      "input": "プログラミング言語",
      "expectedWords": ["プログラミング", "言語"],
      "description": "Segmenter activates on longer words (4+ characters)"
    }
  ],
  "expectedBehavior": {
    "particleMerging": "moderate",
    "segmenterUsage": "selective",
    "navigationSmoothness": 4,
    "accuracy": 4
  },
  "useCases": [
    "General-purpose Japanese editing",
    "Mixed prose and code documentation",
    "Technical writing",
    "Default configuration for most users",
    "Balance between precision and smoothness"
  ],
  "notes": "This is the recommended default configuration. It provides a good balance between navigation smoothness and word boundary accuracy. Suitable for most Japanese text editing scenarios."
}
