{
  "testName": "Precise Word Boundary Configuration",
  "thresholds": {
    "japaneseMergeThreshold": 1,
    "segmenterThreshold": 6
  },
  "testCases": [
    {
      "input": "私は学校に行きます",
      "expectedWords": ["私", "は", "学校", "に", "行", "き", "ます"],
      "description": "Minimal merging - each morpheme separate for precise editing"
    },
    {
      "input": "これはテストです",
      "expectedWords": ["これ", "は", "テスト", "です"],
      "description": "Every particle and auxiliary word separate"
    },
    {
      "input": "彼が来た時",
      "expectedWords": ["彼", "が", "来", "た", "時"],
      "description": "All morphemes treated as separate words"
    },
    {
      "input": "本を読む",
      "expectedWords": ["本", "を", "読", "む"],
      "description": "Even verb stems and endings separate"
    },
    {
      "input": "短い文",
      "expectedWords": ["短", "い", "文"],
      "description": "High segmenter threshold means regex-only for short words"
    }
  ],
  "expectedBehavior": {
    "particleMerging": "none",
    "segmenterUsage": "rare",
    "navigationSmoothness": 2,
    "accuracy": 5
  },
  "useCases": [
    "Precise morpheme-level editing",
    "Linguistic analysis",
    "Grammar study and learning",
    "Fine-grained text manipulation",
    "Code-like structured Japanese text"
  ],
  "notes": "This configuration maximizes word boundary precision at the cost of navigation smoothness. Best for users who need to edit Japanese text at the morpheme level, or for linguistic analysis tasks."
}
